{
  "$schema": "https://json-schema.org/draft/2020-12/schema",
  "$id": "https://collaborative-dynamics.example/schemas/cd-agent-swarm-plan-v1.json",
  "title": "CD Agent Swarm Plan v1",
  "type": "object",
  "additionalProperties": false,
  "required": [
    "format",
    "plan_id",
    "updated_at",
    "mission",
    "acceptance",
    "authority",
    "regime",
    "admission_basis",
    "root",
    "workers",
    "budgets",
    "merge",
    "status",
    "next_move"
  ],
  "properties": {
    "format": {
      "const": "cd-agent-swarm-plan/v1"
    },
    "plan_id": {
      "type": "string",
      "minLength": 3
    },
    "updated_at": {
      "type": "string",
      "minLength": 10
    },
    "mission": {
      "type": "string",
      "minLength": 3
    },
    "acceptance": {
      "type": "array",
      "minItems": 1,
      "items": {
        "type": "string",
        "minLength": 1
      }
    },
    "authority": {
      "type": "object",
      "additionalProperties": false,
      "required": [
        "allowed",
        "reserved",
        "sensitive_material"
      ],
      "properties": {
        "allowed": {
          "type": "array",
          "minItems": 1,
          "items": {
            "type": "string",
            "minLength": 1
          }
        },
        "reserved": {
          "type": "array",
          "items": {
            "type": "string"
          }
        },
        "sensitive_material": {
          "type": "string"
        }
      }
    },
    "regime": {
      "enum": [
        "direct",
        "enlist",
        "assemble",
        "chain",
        "recover"
      ]
    },
    "admission_basis": {
      "type": "string",
      "minLength": 3
    },
    "root": {
      "type": "object",
      "additionalProperties": false,
      "required": [
        "owner",
        "work"
      ],
      "properties": {
        "owner": {
          "type": "string"
        },
        "work": {
          "type": "string"
        }
      }
    },
    "workers": {
      "type": "array",
      "items": {
        "type": "object",
        "additionalProperties": false,
        "required": [
          "id",
          "objective",
          "deliverable",
          "depends_on",
          "read_surfaces",
          "write_surfaces",
          "authority",
          "evidence_required",
          "status",
          "return_condition"
        ],
        "properties": {
          "id": {
            "type": "string",
            "minLength": 1
          },
          "objective": {
            "type": "string",
            "minLength": 1
          },
          "deliverable": {
            "type": "string",
            "minLength": 1
          },
          "depends_on": {
            "type": "array",
            "items": {
              "type": "string"
            }
          },
          "read_surfaces": {
            "type": "array",
            "items": {
              "type": "string"
            }
          },
          "write_surfaces": {
            "type": "array",
            "items": {
              "type": "string"
            }
          },
          "authority": {
            "type": "array",
            "minItems": 1,
            "items": {
              "type": "string"
            }
          },
          "evidence_required": {
            "type": "array",
            "items": {
              "type": "string",
              "minLength": 1,
              "pattern": "^(?!\\s*(?:[Nn][Oo][Nn][Ee]|[Nn][\\s._/-]?[Aa]|[Nn][Oo][Tt][\\s_-]+[Rr][Ee][Qq][Uu][Ii][Rr][Ee][Dd])\\s*$).+"
            },
            "minItems": 1
          },
          "status": {
            "enum": [
              "planned",
              "dispatched",
              "working",
              "returned",
              "reconciled",
              "failed",
              "interrupted",
              "cancelled",
              "closed"
            ]
          },
          "return_condition": {
            "type": "string",
            "minLength": 1
          },
          "started": {
            "type": "boolean",
            "description": "Omit when unknown. False means no dispatch occurred, not that an interrupted write rolled back."
          },
          "output": {
            "type": "object",
            "additionalProperties": false,
            "required": [
              "state",
              "evidence"
            ],
            "properties": {
              "state": {
                "enum": [
                  "pending",
                  "accepted",
                  "rejected"
                ]
              },
              "evidence": {
                "type": "array",
                "items": {
                  "type": "string",
                  "minLength": 1
                }
              }
            }
          },
          "write_readback": {
            "type": "object",
            "additionalProperties": false,
            "required": [
              "state",
              "evidence"
            ],
            "properties": {
              "state": {
                "enum": [
                  "unknown",
                  "reconciled"
                ]
              },
              "evidence": {
                "type": "array",
                "items": {
                  "type": "string",
                  "minLength": 1
                }
              }
            }
          }
        }
      }
    },
    "budgets": {
      "type": "object",
      "additionalProperties": false,
      "required": [
        "concurrency_limit",
        "model_policy",
        "stop_condition"
      ],
      "properties": {
        "concurrency_limit": {
          "type": "integer",
          "minimum": 1
        },
        "model_policy": {
          "type": "string"
        },
        "stop_condition": {
          "type": "string"
        }
      }
    },
    "merge": {
      "type": "object",
      "additionalProperties": false,
      "required": [
        "owner",
        "method",
        "indispensable_gates"
      ],
      "properties": {
        "owner": {
          "type": "string"
        },
        "method": {
          "type": "string"
        },
        "indispensable_gates": {
          "type": "array",
          "minItems": 1,
          "items": {
            "type": "string"
          }
        }
      }
    },
    "status": {
      "enum": [
        "planned",
        "active",
        "recovering",
        "awaiting_evidence",
        "awaiting_authority",
        "closed",
        "cancelled"
      ]
    },
    "next_move": {
      "type": "string"
    },
    "outcome": {
      "type": "object",
      "additionalProperties": false,
      "required": [
        "state",
        "checks",
        "unresolved"
      ],
      "properties": {
        "state": {
          "enum": [
            "unverified",
            "partial",
            "accepted",
            "cancelled"
          ]
        },
        "checks": {
          "type": "array",
          "items": {
            "type": "object",
            "additionalProperties": false,
            "required": [
              "criterion",
              "result",
              "evidence"
            ],
            "properties": {
              "criterion": {
                "type": "string",
                "minLength": 1
              },
              "result": {
                "enum": [
                  "passed",
                  "failed",
                  "not-run"
                ]
              },
              "evidence": {
                "type": "array",
                "items": {
                  "type": "string",
                  "minLength": 1
                }
              }
            }
          }
        },
        "unresolved": {
          "type": "array",
          "items": {
            "type": "string",
            "minLength": 1
          }
        }
      }
    }
  }
}
