{
  "format": "cd-agent-swarm-plan/v1",
  "plan_id": "swarm-20260830-free-nova-v3",
  "updated_at": "2026-08-30T20:47:53.8187843Z",
  "mission": "Build the new Free Nova the Optimal AI as a complete dual-host generalist from current canonical sources.",
  "acceptance": [
    "One Nova front door carries the current ambient MIND and exactly the settled Free capability loadout.",
    "Codex and Claude distributions are assembled from pinned canonical sources without private developer runtime dependencies.",
    "Package, routing, documentation, and independent verification evidence support a local release-candidate handoff."
  ],
  "authority": {
    "allowed": [
      "Read maintained Nova and capability repositories.",
      "Edit and build inside E:\\Github\\nova-the-optimal-ai-mind.",
      "Run local deterministic and bounded behavioral checks."
    ],
    "reserved": [
      "Git push, GitHub release, public publication, store upload, and external announcement require separate user authority."
    ],
    "sensitive_material": "Do not copy private developer paths, credentials, customer data, or Nova estate contents into the product."
  },
  "regime": "assemble",
  "admission_basis": "Three initial bounded audits improved source, architecture, and acceptance coverage; the root recovered one interrupted architecture return, then separate Hesperos and TestForge roles supplied disjoint authoring/operator/reviewer evidence.",
  "root": {
    "owner": "/root",
    "work": "Mission custody, all product and build writes, recovery of the interrupted architecture branch, evidence reconciliation, final validation, and handoff."
  },
  "workers": [
    {
      "id": "source-custody",
      "objective": "Resolve the canonical source tree and current version or commit for every settled Free capability.",
      "deliverable": "A 25-root source matrix with exact paths, versions, evidence limits, and conflicts.",
      "depends_on": [],
      "read_surfaces": [
        "E:\\Github",
        "E:\\Indranet\\Augments\\0 Free",
        "E:\\Github\\nova-emergent"
      ],
      "write_surfaces": [],
      "authority": [
        "read-only"
      ],
      "evidence_required": [
        "Canonical file paths and repository state for every consequential source claim."
      ],
      "status": "reconciled",
      "return_condition": "Return the matrix, unresolved custody conflicts, and any capability that cannot be safely assembled."
    },
    {
      "id": "build-architecture",
      "objective": "Map the smallest migration from Nova 2.1.3 to the current MIND and dual-host edition architecture.",
      "deliverable": "A concrete target tree, reuse map, build-script changes, and migration risks.",
      "depends_on": [],
      "read_surfaces": [
        "E:\\Github\\nova-the-optimal-ai-mind",
        "E:\\Github\\nova-emergent"
      ],
      "write_surfaces": [],
      "authority": [
        "read-only"
      ],
      "evidence_required": [
        "Existing source and build paths supporting the recommendation."
      ],
      "status": "interrupted",
      "return_condition": "Return the target architecture, precise reuse boundaries, and blockers."
    },
    {
      "id": "acceptance-docs",
      "objective": "Define the Free edition customer promise, routing collision probes, documentation journey, and release evidence gates.",
      "deliverable": "A concise acceptance matrix and Hesperos/TestForge gate plan grounded in existing product records.",
      "depends_on": [],
      "read_surfaces": [
        "E:\\Github\\nova-the-optimal-ai-mind",
        "E:\\Github\\nova-emergent",
        "E:\\Github\\testforge"
      ],
      "write_surfaces": [],
      "authority": [
        "read-only"
      ],
      "evidence_required": [
        "Exact governing files for each proposed gate."
      ],
      "status": "reconciled",
      "return_condition": "Return acceptance criteria, collision cases, documentation requirements, and residual host evidence boundaries."
    },
    {
      "id": "hesperos-current-review",
      "objective": "Independently review the repaired customer documentation, package parity, render provenance, and accessibility boundaries.",
      "deliverable": "Current Hesperos independent-review receipts bound to checkpoint 06b89ea3 and the customer ZIP.",
      "depends_on": [
        "acceptance-docs"
      ],
      "read_surfaces": [
        "README.md",
        "docs",
        "dist/nova-the-optimal-ai-free-3.0.0",
        "verification/hesperos-free-v3"
      ],
      "write_surfaces": [
        "verification/hesperos-free-v3/independent-review.md",
        "verification/hesperos-free-v3/independent-review.json"
      ],
      "authority": [
        "bounded evidence writes only"
      ],
      "evidence_required": [
        "Exact source/package parity, render hashes and dimensions, visual reinspection, explicit untested boundaries."
      ],
      "status": "reconciled",
      "return_condition": "Return verdict, material findings, residual conditions, evidence boundary, and touched state."
    },
    {
      "id": "testforge-operator",
      "objective": "Run the repaired candidate through the TestForge operator cycle.",
      "deliverable": "Fresh regression, package, documentation, site, risk, traceability, metered, and operator receipts.",
      "depends_on": [
        "source-custody",
        "acceptance-docs"
      ],
      "read_surfaces": [
        "06b89ea3 source checkpoint",
        "dist",
        "release",
        "tests",
        "verification/hesperos-free-v3"
      ],
      "write_surfaces": [
        "verification/testforge-free-v3/operator"
      ],
      "authority": [
        "bounded verification writes only",
        "no hosted dispatch"
      ],
      "evidence_required": [
        "Fresh captured execution results, canonical manifest and traceability validation, explicit not-run states."
      ],
      "status": "reconciled",
      "return_condition": "Return operator decision, local qualification proposal, validator results, blockers, and metered disposition."
    },
    {
      "id": "testforge-independent-review",
      "objective": "Challenge the stable TestForge packet, repaired lifecycle/workflow defects, artifact binding, and overclaim boundaries.",
      "deliverable": "Independent reviewer verdict and focused adversarial, contract, binding, and validator receipts.",
      "depends_on": [
        "hesperos-current-review",
        "testforge-operator"
      ],
      "read_surfaces": [
        "06b89ea3 source checkpoint",
        "release",
        "verification/hesperos-free-v3",
        "verification/testforge-free-v3/operator"
      ],
      "write_surfaces": [
        "verification/testforge-free-v3/reviewer"
      ],
      "authority": [
        "bounded reviewer evidence writes only",
        "no product repair",
        "no hosted dispatch"
      ],
      "evidence_required": [
        "Independent artifact hashes, focused reruns, reviewer validation, explicit public and host boundaries."
      ],
      "status": "reconciled",
      "return_condition": "Return bounded verdict, material findings, conditions, reopen triggers, and touched state."
    }
  ],
  "budgets": {
    "concurrency_limit": 4,
    "model_policy": "Use the inherited qualified route; keep architecture and final acceptance at the root.",
    "stop_condition": "Stop or re-plan when a worker needs the root's not-yet-settled product decision or any write surface."
  },
  "merge": {
    "owner": "/root",
    "method": "Root independently observed canonical state, recovered the interrupted architecture branch through a single writer, froze checkpoint 06b89ea3, reconciled fresh Hesperos and TestForge returns against exact archive hashes, and retained public rights and publication as separate gates.",
    "indispensable_gates": [
      "authority",
      "single_writer",
      "source_custody",
      "routing",
      "package",
      "documentation",
      "independent_review"
    ]
  },
  "status": "closed",
  "next_move": "Handoff the qualified local candidate. Before public distribution, obtain six component grants, reconcile two metadata sets, rebuild, and rerun package, Hesperos, TestForge, and separately authorized fresh-host acceptance."
}
